ID,num_models,question
554,1,"How many times does a water drop land on a leaf, causing the leaf to shake? (A change of shot counts as an additional instance.)"
557,1,How many times did the scene of only one fish leaping out of the water appear?
558,1,How many creatures resting on branches or leaves did a fish living in the water knock down by spraying a jet of water?
560,1,How many times in total did a woman wearing a black top appear? (An appearance is only counted when the scene changes.)
569,1,How many horses are in the video? (Count reappearances and partial appearances.)
582,1,"In the video, how many fewer times does the dark-colored liquid condiment appear than the clear liquid condiment?"
586,1,How many different tools does the woman in purple use in the video? (Recurring tools are only counted once.)
587,1,"In the video, how many times in total did the woman in the purple ethnic costume dig with the hoe?"
588,1,"In the video, how many liquid seasonings in total were added to the pot, besides water?"
589,1,What is the result of multiplying the number of times the boy in white clothes appears by the number of times the girl in grey clothes appears?
590,1,"In the video, how many chicken feet were caught and thrown into the metal bowl?"
596,1,"In the video, how many more times did the mantis jump than the jumping spider?"
598,1,How many orchid mantises can be seen in the video? (Only count those whose body outlines are clearly visible.)
600,1,"From indoors to the lakeside, in how many different locations does the woman wearing red earrings appear?"
608,1,How many pygmy monkeys appeared in the video?
610,1,How many times in the video does the pygmy marmoset gnaw on the tree trunk?
611,1,How many times did the boy in the white shirt with a fish pattern turn his head to look at the girl?
612,1,"From the start of picking until she sat on the rock, how many times in total did the woman in the black top pick a yellow fruit? And how many times did she eat a yellow fruit? (It only counts as one time if it was completely eaten.)"
613,1,"In the process of making the food, from pouring the yellow fruit into the metal pan to covering the filling with the dough, how many different ingredients were used for the filling in total?"
617,1,How many different kinds of birds are in the video? (The birds flying in the background are counted as the same kind.)
618,1,How many times does the scene of birds gathering on the ground appear?
624,1,How many times did the action of grabbing and releasing the line-shaped objects on the board occur?
628,1,"In the video, how many times does the man in the black top pick up food with his chopsticks? What is the ratio of the number of times he eats the food after picking it up to the total number of times he picks up food?"
641,1,What percentage of the rusty-spotted cat's total appearances in the video are on the wood? (Each time its head fully appears or the scene changes is counted as one appearance.)
644,1,How many times do scenes with scissors appear in the video?
645,1,How many times did the yak appear in the video in total?
648,1,How many monkeys running in the desert appeared in total in the video? (Repeated appearances are included in the count.)
649,1,In how many different scenes do the scissors appear during the hat-making process? (Shot changes are counted.)
652,1,How many times did hand-sewing appear during the hat-making process? (Shot changes are included in the count.)
654,1,How many bites of meat did the man in the white shirt take from the bone before putting it down?
657,1,How many times does a black-haired woman wearing clothes with a floral pattern and a necklace appear in the video?
658,1,"During the process of cooking the blood sausage, how many times in total did the woman in the red top lift the pot lid?"
662,1,How many times in the video does the action of scooping up the tofu dish with a spoon and pouring it onto the rice appear?
663,1,"In the video, how many times in total did the man in the white top put food into his mouth with a spoon?"
668,1,"In the video, how many different items in total has the man in the black top held in his right hand?"
671,1,"In the video, how many times in total did the elderly person in the blue top spread the straw?"
676,1,How many times in total does the lady in the pink floral top make a complete scraping motion with her knife? (One scrape is counted from when the knife touches the food until it leaves the food.)
680,1,"In the video, how many times did the wolves successfully bite the bison?"
681,1,How many different types of ingredients appeared during the barbecue?
683,1,"Indoors, how many different food ingredients did the woman in the striped top touch in total? (Ingredients in the same container are counted as one type)."
691,1,How many contacts occurred between the wasp and the frog? (An instance is counted from contact to departure.)
693,1,"While preparing the cabbage, how many outer leaves in total did the old person in red clothes throw away?"
718,1,How many times does the woman wearing a yellow safety helmet clap in the clip?
726,1,"How many times in total did the brown-haired lady, wearing a black top and no mask, look at a mobile phone with other people?"
729,1,How many people are drinking water from the green paper cups?
731,1,Which of the following players has successfully stopped the ball from entering the goal the most times? (Repeated occurrences are counted)
732,1,How many more saves did the player in the green jersey make than the player in the yellow jersey?
734,1,How many times in the video does the elderly woman wearing a red inner layer touch the wall?
737,1,"In the video, what is the difference in the number of shot attempts between the team in red shirts and the team in white shirts?"
754,1,"How many crabs in the video performed a ""jumping"" motion?"
755,1,How many times in the video do two penguins with similar actions and visible faces appear at the same time?
759,1,How many shots were hit in total between the man in the black top and the man in the light blue top on the badminton court?
760,1,What is the proportion of people wearing black tops among those around the lady in a black dress?
763,1,How many kicks did the team in white tops make in total? (Replays are included in the count.)
766,1,How many times does the goal appear in this video?
767,1,How many times in total were ingredients added to the pot during the cooking process?
772,1,How many different kinds of food did the woman in the white jacket cut on the cutting board?
774,1,How many people passed by wearing a white fluffy sleeveless vest?
778,1,How many times did the elderly lady in the pink top scrape the fat off the pork skin with a spoon while processing it?
784,1,"How many times in total is a woman in a black down jacket, who is trying to open a wooden crate with a crowbar, shown holding the crowbar with both hands? (Camera cuts are counted)."
792,1,How many times were ingredients and seasonings added to the black pot in the video?
801,1,How many times in total were cooking ingredients added to the pot during the cooking process?
802,1,How many times does the river appear? (Scene changes are included in the count.)
806,1,How many times did the player in the yellow jersey fall while making a save to stop the ball from going into the net?
810,1,"During the meal, a man wearing a black top used chopsticks to pick up food. What percentage of the total food items he picked up were dipped in the seasoning inside the white container?"
811,1,"In the video, how many different locations do the two ladies appear in in total?"
813,1,How many times in total did the complete action of putting ingredients into the black pot and then stirring them with an iron spatula occur?
814,1,How many different outfits has the blonde girl worn in total?
816,1,How many times does the action of holding both hands open in the air occur? (Instances where only one arm is visible do not count; repeated occurrences are counted multiple times; each appearance after a complete camera cutaway is counted as a new instance.)
818,1,"Between the team in blue jerseys and the team in red jerseys, which team's players appear more frequently?"
822,1,How many types of non-liquid ingredients did the lady put into the purple bowl?
824,1,"On the soccer field, what proportion of the goal-blocking actions performed by the man in the grey-black top involved him using body contact to change the ball's trajectory?"
826,1,How many backhand shots did this woman hit? (Replays are included in the count)
827,1,How many different training exercises did the man in the white top and pants do in total?
829,1,How many times does the man in the grey jacket skewer squid with bamboo skewers? (Repetitions are also included in the count.)
833,1,How many times in total did the woman in the white top and black pants hit the ball?
836,1,What is the proportion of goals scored by directly kicking the ball into the net out of all valid goals? (Excluding replays.)
839,1,"Red, yellow, and light blue jerseys all appear. Which color jersey appears most frequently in the video?"
841,1,How many different performances did the woman in the white and blue costume give using the red table?
844,1,How many times did the man wearing a camouflage top raise both legs straight up at the same time?
853,1,How many times in total did the men in the red top and the off-white top hit the ball with their rackets in the video? Who won the point when the ball finally landed?
854,1,The number of bowls held by the woman in the black and purple performance costume varies. What is the maximum number of bowls she holds with both hands?
856,1,"In the video, what is the sum of the number of times the curved metal device was held in the mouth by the man in camouflage and the number of times it was held in the mouth by the child in camouflage?"
865,1,How many times did the board tilt to the woman's right while the woman in blue and white was performing on the white board?
866,1,How many times in total did the man in camouflage clothing hold a legs-together position while completing the handstand?
868,1,How many times in the video did the woman in the red dress appear with her feet dangling?
870,1,"How many times did the man with yellow hair, wearing a red performance costume, throw the bowl from his hand to be caught by the woman performing a unicycle act?"
871,1,"In the video, how many poses by the performers in camouflage last for 2 seconds or more?"
873,1,How many times did the woman in the purple top spray?
874,1,"In the video, how many times in total do player #8 and player #11, both in white jerseys, high-five?"
879,1,How many people climbed the black pole?
880,1,How many people spread their arms?
883,1,How many different climbing methods did the person on the steel pole use?
884,1,How many different poses did the two people in blue and white clothing change into in total after being suspended?
885,1,How many times in total did the man wearing the lion dance costume squat on the tightrope?
890,1,How many people appeared in the video in total?
892,1,How many times does the prop of the performer in the silver costume rotate during the performance? (Round the result up to the nearest whole number.)
894,1,"In the video, how many different actions did the man wearing a red hat perform while holding the white spray gun?"
895,1,How many times in total were seasonings and ingredients added to the pan in the video?
899,1,How many times did the little girl in the video open the door?
913,1,How many enemy heroes did the blue team kill in total in the video clip?
916,1,How many kills in total occurred in the final game screen? (A player killed again after respawning counts as two kills.)
917,1,"In the video, how many times does the shuttlecock hit the ground?"
918,1,"In the video, how many times in total did the woman in the red top and black shorts hit the shuttlecock during the second rally of the badminton match? (The serve is counted as a hit, and a rally is from the serve until the shuttlecock lands.)"
919,1,How many times did the blue arrow-shaped ranged skill appear in the video?
927,1,"In the video, how many actions did the person in the pink plaid top perform before holding the banknote?"
930,1,"Specifically, how many different ways were the noodles processed during the cooking process in this video?"
931,1,"In the video, how many times in total was the pink towel scrubbed in the basin and the sink?"
938,1,How many types of food are put into the rice cooker in the video?
944,1,How many pieces of tableware with different shapes and colors are there in the video?
945,1,How many times does the video show liquid and powder being added to the bowl?
946,1,"How many times in total was the ""sweeping"" action performed with the broom covered by a red plastic bag in the video?"
949,1,How many different types of headwear appeared in the video?
950,1,What is the difference between the number of men who appear indoors in the video and the number of umbrellas held by women?
953,1,"In the video, what is the difference in the number of pink ring-shaped devices on the man's initial hang glider design compared to the one actually used outdoors?"
957,1,How many different kinds of earrings appeared in the video?
959,1,"The number of lit lanterns in the video, plus the number of lanterns the woman in red throws onto the snow, what is the total number?"
974,1,How many times does a plane appear in the video?
988,1,"Based on the changes in the characters' clothing in the video, how many different military uniform colors appeared from the appearance of the soldier image in the early days of the founding of the People's Republic to the display of the individual business license?"
991,1,How many different people with smiles on their faces appeared in total throughout the video?
997,1,"The video shows a woman and a man appearing in different scenes. In their respective scenes, how many shots are there of a character looking at the scenery outside the window?"
999,1,"Based on the video, in the scenes showing different segments of the protagonist's career, how many times is the protagonist seen using a mobile phone? (Excluding close-ups of the phone screen.)"
1009,1,"According to the video, how many times does the environment change in the scenes depicting the soldiers?"
1012,1,"Based on the sports shown in the video, if we only count the fully showcased individual events (excluding team events), how many individual sports are there in total?"
1019,1,"Based on the video, how many different people appeared on screen after the scene switched to the interrogation room?"
1022,1,"Based on the scenes that appear in the video, which of the following statements about the number of scenes is correct?"
1025,1,"Watch the video. From the start of construction on the wooden structure to the final topping out of the tower, how many scenes are there of painting on the wooden boards?"
1027,1,"The video shows a clip of an actor getting a job offer after passing an audition. From the moment the actor is notified they passed the audition to when they finally get the script on set, how many times does a coffee cup appear?"
1028,1,"In the video, for how many aspects in total did the head of the Zhengzhou Culture and Tourism Bureau apologize to Handan?"
1033,1,"Based on the workers' attire and work settings in the video, how many different work locations can be inferred at a minimum?"
1036,1,"In the video, how many times do scenes of the Guqin being played appear, and what is the color of the performer's attire each time?"
1041,1,"In the video, from the start of the bamboo weaving to the end of the meeting with the team in formal wear in the conference room, how many hand close-up shots (showing only hand movements, not the full person) appeared?"
1043,1,What is the difference between the light thresholds of the two lamps adjusted in the video clip?
1049,1,How many cats appeared in the video?
1051,1,How many more times did the woman in the video do the second movement than the first?
1056,1,How many times did the woman in the video turn?
1059,1,How many packages are in the big cardboard box in the video?
1069,1,"What is the ticket price in the video equivalent to in RMB, calculated at the exchange rate of 16:10 on June 3, 2025?"
1070,1,How many coffins containing mummies are shown in the video in total?
1071,1,How many times did the dancers in green change formation in the video?
1073,1,How many goals are there in the video?
1074,1,How many cups do the performance props in the video consist of?
1078,1,How many men are present at the competition in the video?
1082,1,How many years passed between the maiden flight and the end of production for the aircraft in the video? How many years passed from obtaining the airworthiness certificate to the end of production?
1083,1,How many leisure and entertainment activities appear in the video?
1091,1,How many cats are outdoors in the video?
1092,1,How many toy car boxes appear in the video?
1094,1,How many chemical terms are in the video?
1107,1,"In the video clip, how many more people are wearing red than purple?"
1108,1,How many clubs appear in the video in total?
1111,1,What is the approximate difference in latitude between the source and the end point of the river introduced in the video?
1112,1,How many different looks appear in the video?
1114,1,How many times do buildings named after poems appear in this video?
1116,1,How many ingredients in total make up this man's breakfast and lunch in the video clip?
1117,1,What is the difference in quantity between the flags shown individually and the national flags presented collectively in the video?
1123,1,What is the sequence of the color changes of the prop in the woman's hand in the video?
1125,1,How many swimming rings did the vlogger throw into the basin in the video?
1132,1,How many small tips did the author demonstrate in the video?
1135,1,How many movements did the man in the video demonstrate? How many of them target the upper limbs?
1140,1,How many times does the masked character appear in the video?
1141,1,How many types of natural disasters are shown in the video clip?
1142,1,How many main promotion markets for export porcelain are there in the video clip?
1143,1,How many people appeared in the video clip?
1148,1,How many types of boards were used in the video?
1151,1,How many boxes of dolls were collected in total in the video?
1152,1,How much greater is the tensile test result in the video than the standard result?
1157,1,How many materials did the two people in the video take out of the building in total?
1158,1,How many times in total was the paper shown in the video folded?
1159,1,How many species of birds appeared in this video clip?
1163,1,How many propellers in total does the aircraft introduced in the video have?
1165,1,How many rockets are in the last picture of the video?
1171,1,How many times do the male and female leads almost kiss in the video?
1173,1,"On the runway introduced in the video, how many fewer lights are on one side of the runway compared to the number of runway centerline lights?"
1177,1,How many power lines are in the sky after the teal and orange scenes in the video?
1185,1,How many minutes are there between the time shown in the video and the plane's takeoff time?
1192,1,"According to the calculation method in the video, which dynasty was China in at 12:00 PM?"
1199,1,How many times was the air purifier pushed in the video?
1200,1,How many hangers are in the video?
1201,1,"How many characters are there in total on the phone screen in the video, and how many are there when it's zoomed in all the way?"
1214,1,How many black flags are there in the video clip?
1221,1,How many animals are in the background of Little Red Riding Hood in the video?
1224,1,How many monitors are in the office in the video?
1225,1,"In the video, how many balls are placed in each team's area?"
1232,1,How many characters long is the password being cracked in the video? How many of them are English characters?
1233,1,How many items were taken out of the cabinet in the video in total? How many of them were pens?
1234,1,What year was the plane in the video produced?
1237,1,"According to the video, how many minutes faster is it to cook rice in a stockpot compared to a rice cooker?"
1245,1,How many times did the people in the video clink glasses in total?
1246,1,How many times in total was the doll pressed in the video?
1247,1,How many people appear in the video?
1252,1,"According to the video, what is the estimated body weight in kilograms of the person used as an example?"
1253,1,What is the approximate speed of the proton beam mentioned in the video?
1255,1,How many times was trash thrown into the trash can in the video?
1275,1,How many circles did the pencil draw on the paper in the video?
1278,1,"In the Nordic travel tutorial video, by what percentage is the course more than the exclusive session?"
1279,1,How many calligraphy copybooks are in the video? And how many of them are by the same person?
1282,1,"In the video, how many times in total did the Band-Aid appear as a little trick?"
1284,1,How many types of footwork are shown in the video?
1285,1,How many fewer types of karst landforms classified by exposure conditions are there in the video compared to those classified by climate zones?
1291,1,How many creases are there in total on the item made in the video?
1293,1,How many scenic spots featuring mainly natural landscapes are shown in the specified video clip?
1294,1,How many complete dumbbell lifts did the man in the video perform while lying down?
1295,1,How many times does the basketball hit the ground in the video?
1305,1,How many books were flipped through in the video?
1306,1,How many gray-green doors appeared in total in this video?
1309,1,How many meetings are mentioned in total in the video?
1313,1,How many children in the video are holding spherical objects?
1314,1,How many items are stored in the outermost compartment of the backpack in the video?
1315,1,How many types of paper towel holders were made from clothes hangers in the video?
1316,1,"How many times is the word ""X-Knob"" mentioned in the video?"
1317,1,"According to the video, how many more grams of meat can a British soldier eat per day than a British civilian?"
1318,1,How many outfits should be shown in the video?
1321,1,How many bed sheets are there in the video?
1330,1,What is the annual interest rate of the silver borrowed by Scholar Dou in the video?
1333,1,"How many tasks are mentioned in the video? Of those, how many is the video creator responsible for?"
1341,1,"Among the people appearing in the video, how many adults and how many children are there respectively?"
1353,1,How many kinds of vegetables does the person in the video show?
1360,1,How many paper cups were knocked down in total in the video?
1363,1,How many leaves did the woman in the video cut off in total?
1364,1,How many of our country's satellites were shown in the video in total?
1370,1,"How many times does the word ""Xianglong"" appear in the video?"
1373,1,"Excluding their own seat, how many seats to the left did the first-person filmer pass?"
1374,1,How many different shapes of hats or conical hats appear in the video?
1375,1,Calculate the domestic time based on the time displayed in the first frame of the video.
1376,1,How many backflips did the person in the video do?
1380,1,How many times in total did the man and woman in the video throw beanbags at each other?
1381,1,How many straps are on the person's clothes in the video?
1386,1,What is the approximate percentage of Class I nationally protected wild animals among the nationally key protected vertebrates found in the province shown in the video?
1391,1,How many people in total walked onto the stage in the video? And how many of them were wearing white jackets?
1393,1,"In the video, the camera pans across the audience seats. How many people are wearing hats?"
1395,1,"The video mentions that after many years of the War of Resistance, a number of outstanding military commanders emerged in the Chinese army. How many are mentioned in the video?"
1396,1,"How many wooden slats make up the bed frame lengthwise, as shown in the video?"
1398,1,How many times was the page turned in the video?
1400,1,How many people operating machines with their bare hands appear in the video?
1405,1,How many people in the video are wearing clothing with red elements?
1407,1,How many years has the book in the video been published as of 2025?
1413,1,How many photos of women were shown in the video in total?
1419,1,How many types of competitions were introduced in the video in total?
1426,1,"How many straight lines did the person in the video draw in total? Of those, how many were not intersected by the circle in the middle?"
1431,1,How many animals appeared in the video?
1433,1,How many currency exchange rates are shown on the display screen behind the woman in the video? Which currency has the highest rate?
1438,1,How many pairs of socks were taken out of the drawer in the video?
1439,1,How many math questions did the reporter answer during the ab roller training?
1440,1,How many artworks are shown in the video in total?
1445,1,"When the two main individuals responsible for the accident, Tinsley and Mikan, died, how many years had passed since the accident, respectively?"
1446,1,Approximately how much RMB did the man in the video spend on a ticket to Otaru?
1453,1,How many beautiful scenes are shown in the video?
1455,1,How many times in total did the child in the video dock?
1460,1,How many animal species appeared in total on Deception Island in Antarctica in the video?
1464,1,How many times did the group closest to the camera exchange the tossed props?
1465,1,I saw the author's fixed deposit certificate in the video. How much money can be retrieved when the deposit matures?
