ID,num_models,question
143,7,How many countries' iconic buildings appeared in the video?
451,7,What is the result of multiplying the number of types of non-liquid ingredients added to the yellow bowl by the number of types of non-liquid ingredients added to the black pot?
835,7,"In the video, in how many different locations do the white-haired man and the man with the hat appear at the same time?"
1485,7,How many times did the cat in the video hit the lid?
27,6,How many minutes a day is the service center in this video clip open?
292,6,How many steps of this Intangible Cultural Heritage are mentioned in the video?
326,6,"In this video clip, how many times do all the players in blue jerseys touch the ball?"
341,6,"In the picture, how many people are there in total, including the people on the stage and the people holding signs with English text? (Duplicates are not counted.)"
634,6,How many pavilion pillars can be seen in total?
694,6,How many leaves were picked off the Chinese cabbage in the hands of the old lady wearing a red embroidered coat?
713,6,"In the video, how many balls did the female athlete wearing dark blue sportswear hit but fail to get over the net?"
742,6,How many times in total does the red race car appear on the track in the entire video?
963,6,The number of items held by the short-haired woman in the video changes. What is the product of the maximum and minimum number of items she holds?
1081,6,How many chemical elements appeared in the video?
1119,6,What is the growth rate from the minimum to the maximum value in the video frame?
1179,6,Approximately how many fewer liters of fuel does the fighter jet in the video consume during standard flight compared to when using the afterburner?
1180,6,How many more liters of fuel does the fighter jet in the video have with full drop tanks compared to the centerline drop tank?
1217,6,How many kinds of exercise equipment appear in the video?
1371,6,How many properties of the materials are mentioned in the video?
12,5,How many cardboard boxes are used in the video?
22,5,How many fewer solid-colored discs are there than multi-colored discs in this video clip?
101,5,How many quintessences of Chinese culture does the author in the video believe are on the verge of being lost due to their high difficulty?
148,5,How many boxes did the player draw in the video with five pulls?
149,5,By how many tons does the cargo carried by the vessel in this video clip exceed the maximum load capacity?
230,5,How many attempts did the orca pod make to capture the first seal?
234,5,What is the price difference in US dollars between the most expensive and cheapest items the girl is wearing in this video clip?
263,5,How many people are performing in the clip?
269,5,How many different breeds of cats appear in the video?
287,5,How many men appeared in the video?
340,5,How many players in total can be clearly seen falling to the ground? (Repeated appearances are counted.)
345,5,"In the video, how many more squid were picked up by the woman in the white coat than were eaten later?"
488,5,"Which value is the greatest: the number of times the woman rolls the dough into a flatbread, the number of times she flips the flatbread in her hands before putting it in the oil pan, or the number of times she touches it with tongs after it is in the pan and bubbles have appeared? (Taking the flatbread out with the tongs does not count as touching it.)"
555,5,How many times did a clear picture of a treeshrew licking a pitcher plant appear?
576,5,"How many different types of animals appear in the video? (If an animal appears more than once, only count it once.)"
601,5,What is the combined number of appearances of the drongo and the meerkat in the video clip?
605,5,How many times does the woman in the white jacket appear in the full video?
687,5,"In the video, how many times in total did the pika run to its den in the rocks carrying plants?"
845,5,"What is the difference between the number of times the man in the camouflage top touches the silver cylinder with both hands, and the number of times he touches it with a single hand?"
869,5,How many times did the woman performing the unicycle act kick the bowls from her foot to her head?
893,5,"If a stable movement in the video is considered one counting unit, how many stable movements in total did the performer in cyan-green clothing complete during the continuous sequence of actions?"
909,5,What is the total sum of the number of flames and flags on the wall? (Three consecutive flags count as one)
982,5,"According to the video content, what is the maximum number of times the blind girl touches Braille with her hands in outdoor scenes?"
1072,5,How many times do snowy scenes appear in the video?
1248,5,What is the difference in years between the invention of the two types of paper mentioned in the video?
1312,5,How many balls are on the ground in the video?
1361,5,How many coins in total were dropped in the video?
1366,5,How many people are in the video?
1447,5,How many paintings appeared in the video in total?
26,4,"How many days were there between the murderer's first and second crimes, as introduced in this video clip?"
32,4,What is the total face value of the banknotes that are clearly visible in the video?
54,4,How many sets of outfit comparisons appear in this video clip?
60,4,How many items in total were in the travel bag that the airline gave to the male passenger in the grey top at the end of the video?
85,4,How much cheaper is the combo ticket compared to a regular ticket for visiting the entire park featured in this video?
92,4,How many light-years away from Earth are the first and second planets mentioned in the video combined?
108,4,How many different traditional cultural performances does this video clip show?
113,4,How many steps are mentioned in this video clip for the printmaking process?
115,4,How many liuli-making techniques are introduced in the video?
120,4,How many flips in a row did the man in the video do?
125,4,How many white animals are there in total in the video?
151,4,How many methods in total did the woman in the video use to prevent her cat from peeking at her while she was bathing?
161,4,How many kinds of animals are shown in the video?
164,4,How many pairs of earrings are shown in this video clip?
174,4,How much would it cost to order every dish in the rightmost column of the menu at this barbecue restaurant?
201,4,"In the specified video clip, how many times in total did the man sprinkle the powdery substance onto the snack?"
204,4,How many times as many cats as dogs are there in the video clip?
206,4,How many logs did the woman in the video pick up in total?
257,4,At what age did the person mentioned in this video move to Paris?
258,4,How many people appeared in the video?
283,4,How many people appeared in the video clip?
288,4,How many years passed from the construction of the arena in the video to its excavation?
331,4,How many different physical exercises did the man demonstrate? (Dribbling a basketball counts as only one.)
342,4,"During the cooking process, how many times in total were cooking ingredients added to the silver container?"
372,4,What is the result of subtracting the number of times a white solid substance is poured into the large pot from the number of times the chef making the food pours an uncooked white powdery substance into it?
379,4,How many different auxiliary tools did the man wearing a hat use to process the pottery blanks while making pottery?
380,4,What is the cube of the number of times the man selling tofu cuts the tofu?
430,4,"In the video, a woman in a black padded jacket is digging for caterpillar fungus. How many digging motions did she make in total?"
437,4,Which kitchen utensil is used most frequently during cooking?
447,4,"In the video, what is the difference between the number of lychees on the table that the woman ate and the number she peeled and put into the bowl? (Count it as one if you can see the lychee flesh falling into the bowl.)"
470,4,How many kinds of ingredients in total were put into the copper hot pot?
472,4,"In the video, how many times does the man in black chop the chicken feet? (One up-and-down motion of the cleaver counts as one time.)"
493,4,What is the total number of meerkats in the video performing the action with their forelimbs down and hindlimbs up? (A meerkat with only one forelimb down or one hindlimb up should also be counted as one.)
501,4,How many times were the wontons scooped up in total?
556,4,How many species of sea creatures were there in total (excluding shellfish)?
593,4,"When making mooncakes, what is the total number of times if you add the number of attempts using a mold to the number of times you successfully made them?"
595,4,How many times the number of white objects appearing at the very beginning of the video is the number appearing at the very end? (The number of white objects is at least 1 in both cases.)
619,4,"In the video, how many times were crabs put into the black pot?"
620,4,How many more crabs were scrubbed with a pink brush than were cut in half? (Count only the visible processing.)
621,4,"During the process of cooking the crab, how many times in total were cooking ingredients added to the black pot?"
627,4,"In the video, how many vegetables were picked from the ground in total? (including Chinese cabbage and chili peppers)"
690,4,"In the video, how many times in total does the frog kick its legs from a curled to a straight position?"
696,4,What is the total number of times the carving knife appears during the process of making the wooden utensils? (Including frame-by-frame counting)
701,4,"In the video, what fraction of the total number of steamed buns is the number of unsteamed buns?"
702,4,How many ingredients did the woman add to the golden bowl while making the food?
715,4,How many buckets in the video are shown pouring out or being filled with sweet potatoes or sweet potato flour?
744,4,How many times does the polar bear cub in the video slide down? Only slides exceeding half a body length should be counted.
776,4,How many chickens did the man smoking a cigarette catch?
779,4,How many men in green tops appeared during the training? (Repeated appearances are counted.)
789,4,"In the skating competition scene, how many people did the team member in the red top overtake in total?"
800,4,What is the difference in the number of people between the most and least crowded scenes during the assembly of the blue machine?
847,4,How many times did the man in the camouflage top jump with one hand?
891,4,How many times did the video switch to a shot of a person?
901,4,How many different types of gym equipment appear in the gym in the video?
914,4,How many kill events appear in the video?
942,4,How many times does the video show the woman in black putting garlic into the glass jar?
973,4,"According to the video, among the four professionals shown, how many directly show signs of fatigue or are in a state of rest after completing their work?"
981,4,How many times do scenes showing orange letters appear in the video?
1006,4,"According to the video, after the male and female protagonists finish their conversation in the woods, they leave in different directions. How many times in total does the female character look back before the video ends?"
1023,4,How many times in total were scenes inside a vehicle shown in the video?
1030,4,How many shots directly or indirectly show feet from the beginning of the film until the first time the police check the box containing the body?
1032,4,"In the video, figures representing different professions appear in sequence, accompanied by the presentation of the ""新"" (xīn) logo. Among all the professional figures shown, how many times does the ""新"" (xīn) logo appear in total?"
1044,4,What are the main aspects of Changsha showcased in this video clip?
1089,4,"How many times do ""didadid"" and the corresponding action appear in the video?"
1103,4,How many works appear in the video?
1104,4,How many of the movies in the video are about war?
1176,4,What is the approximate difference in kilometers between the lengths of the longest rivers of the two countries introduced in the video?
1194,4,"In the video, how long did it take to get from Xinxiang Station to the Baoquan Tourist Center?"
1203,4,Approximately how old is the brand owned by the company in the video?
1209,4,How many times did the person in the video open the drawer?
1231,4,How many heads are in the video?
1254,4,How many drones are shown in the video? How many of them are twin-rotor drones?
1308,4,How much would it cost to buy one of each product that appears in the video?
1323,4,"According to the video, how many space launches took place in July?"
1331,4,How many times in total were the pull-out baskets or drawers pulled out in the video?
1334,4,"During the second flight in the video, what local time does the period of direct sunlight into the cockpit correspond to?"
1352,4,How many times in total did numbers appear in the center of the video?
1388,4,How many pieces of furniture does the vlogger show the price for in the video?
1409,4,"How many cups were picked up in total in the video? Of those, how many are not transparent?"
1425,4,Approximately what year was this descendant of Lin Zexu in the video born?
1442,4,How many types of animals appear in the video?
1451,4,How many brushwork techniques were shown in total?
1487,4,How many colors of books are there on the bookshelf in the background of the video?
1495,4,"In the video, what is the difference between the number of times items are placed into the washing machine and the number of times items are taken out of it?"
1499,4,How many items of clothing are shown in the video? (excluding hats)
1502,4,"How many places in the video were wiped with the white cloth strip? (In the same scene, different locations are all counted towards the total.)"
1504,4,"In the video, how many times in total was the black lump hammered? (Count repetitions.)"
1525,4,"How many times does the white, ring-shaped building appear in this video?"
1532,4,How many animal species are shown in the video?
7,3,How many birds appear in the video?
14,3,How many people are there in total on the dragon boat in the video?
15,3,How many items did the visitor obtain in the video?
18,3,How many times does the woman in red pout in the video?
29,3,What is the time difference between the earliest and latest street performances in this video clip?
31,3,"Of the two men in the video wearing the lion dance costume, how many times did the man at the tail of the lion lift up the person in front?"
37,3,Which empty bottle shown in the video is the most expensive?
50,3,"In this video clip, how many more black bags are there than bags of other colors?"
57,3,What is the difference between the highest and lowest temperatures that the red flag in this video clip can withstand?
61,3,How many scenes from the drama and movie versions were shown in total at the end of the video?
63,3,How many items in total are vacuum-sealed in the video?
65,3,How many kinds of delicious food appear in this video?
69,3,"Based on the MSRP and discount information shown in the video, calculate the discounted prices for the vehicle in the four regions mentioned."
72,3,How many floors of stairs did the explorers climb in the unfinished building?
86,3,How many more utensils are in the first picture than in the second in this video clip?
90,3,How many Korean comments appeared in the video?
94,3,How many hundreds of millions of years separate the birth times of the first and second organisms mentioned in this video clip?
96,3,What is the approximate percentage of survivors out of the total number of combatants in the war presented in this video?
118,3,What is the difference in the number of volumes between the two parts of the books mentioned in the video?
119,3,"How many years passed from the establishment of the first hereditary dynasty mentioned in the video to the founding of the first centralized, unified dynasty?"
137,3,How many types of animals (in broad categories) appear in this video?
138,3,What are the approximate calories (in Kcal) of the syrup made in this video clip?
142,3,How many kinds of food did the man in the video order?
163,3,How many character experiences are shown in the video?
165,3,What is the approximate total calorie count of the cake made from the recipe shown in the video?
179,3,How many times was the action shown in the video performed?
183,3,How many times is the thread wrapped around the needle in the picture?
189,3,How many scenes are shown in the video?
190,3,How many times did the performer in the video successfully jump rope?
197,3,How many types of cat food are shown in the video?
223,3,How many scenes were in the video?
227,3,How many kinds of skewers did the person in the video take in total? Which kind was taken the most?
231,3,How many women wearing white dresses appeared in the video?
233,3,How many kinds of fruit did the man in the video put on his plate?
246,3,"As the woman in the video is picking up the cakes, which number is the ""lava chocolate cake""?"
250,3,How many lions are there in the video?
264,3,How many models have clothing that touches the ground in the specified video segment?
267,3,How many unique individuals appeared in the video?
270,3,How many outfits does the woman in the video have to go with the black bag?
291,3,What is the difference between the number of boats with red flags and those without in the video footage?
294,3,How many men appear in the video in total?
299,3,How many people are wearing orange clothes in the video clip?
302,3,How many mice are in the experiment in the video clip?
304,3,"In the video, a woman in a black suit and a man in a yellow vest each spoke several times. What is the difference in the number of times they spoke?"
312,3,How many different colors of No. 7 jerseys appear in the video?
327,3,How many goals were scored in total in the World Cup clip? (Goals shown in replays should also be counted.)
333,3,How many times did chicken feet appear in the video?
350,3,"When making the sauce for the duck, how many more liquid seasonings are used than non-liquid seasonings?"
353,3,How many times does the man in the white top appear throughout the video? (Each camera cut counts as one appearance; back views are not included.)
357,3,"In the process of preparing the ingredients, which of the following ingredients is cut the most times?"
364,3,How many times were the hawthorn berries put into the pot? And how many times were they taken out of the pot?
367,3,What is the difference in the number of shots between the team in white jerseys and the team in red jerseys?
378,3,"During the pottery-making process, the maker used a wooden tool for shaping and decoration. In total, how many types of operations were performed?"
403,3,What is the total number of times the lady pours water and seasoning into the metal basin containing seafood?
404,3,How many different scenes does each person in the video appear in? (Recurring scenes are counted only once.)
411,3,"In the video, how many times does the scene of the man in the white top grabbing and mixing the bullfrogs in the container appear?"
414,3,In how many scenes does the female character with text on her face appear? (Repeated appearances are counted.)
419,3,What is the difference between the maximum number of meat slices on the stone slab at any one time and the number of meat slices ultimately eaten by the woman in the ethnic costume?
420,3,How many jars of food with golden lids appear in the video? (Items that reappear in the same scene are counted only once.)
421,3,"According to the video, how many types of food with strawberries were shown in total?"
423,3,How many times did the woman in the colorful patterned top add white powder from the green container to the basin of white powder? And how many eggs did she add?
445,3,In how many different scenes in the video did the oysters in the bamboo basket appear?
449,3,How many kinds of non-liquid ingredients were added to the black clay pot in total?
458,3,How many colors of fabric and thread in total are used by a man in a light khaki cowboy hat while he is making handicrafts?
459,3,How many kinds of ornaments did the person wearing a watch add to the sewn fabric while making the handicraft? (Thread and string are not included).
461,3,"What is the total number of times cooking ingredients were added to the pot, from when the pressure cooker starts to vent steam until just before the black cauldron is stirred? (The same type of item is counted only once.)"
469,3,"According to the video, how many people are at the dining table?"
494,3,"In the video, how many times in total did the dwarf mongooses jump? (A jump is counted for any dwarf mongoose as long as both its front and hind limbs are off the ground. Cases where the front and hind limbs are not observed simultaneously do not count.)"
497,3,How many times does a shot of a hand holding two ham sausages appear in the video?
498,3,How many steps did the woman in the video take in the process of making the handicraft?
509,3,How many times did the basket with the watermelon appear during the picnic?
530,3,"In the multiple scenes of monkeys foraging by the sea, how many more scenes are there of monkeys eating crabs than of them not eating crabs? (Each change in camera shot is counted.)"
533,3,How many times in the picture does the spider wrap an item with its silk?
547,3,"On the football field, what is the difference between the number of times the person in the red top fell and the number of times the person in the fluorescent yellow top fell? (Falls shown in the replay footage are also included in the count.)"
563,3,"What is the number of people riding bicycles, plus the number of people walking, minus the number of people standing on the side of the street?"
566,3,What is the difference between the number of birds caught and eaten (replays not counted) and the number of birds that escaped after being bitten?
571,3,How many different Tibetan activities are shown in the video? (Repeated occurrences are counted as one.)
575,3,How many feeding actions did the woman actually complete while feeding the cow(s)?
594,3,"In the video, what is the total number of semi-finished mooncakes on the table?"
602,3,How many kinds of seasonings and side dishes in total are added in this beef cooking video?
603,3,"In the video, how many things in total did the woman in pink add to the bowl?"
606,3,"Excluding close-up shots of other fish, how many times in total does the school of fish appear in the video?"
607,3,"In the video, did the middle-aged man in a white shirt, holding a cyan bottle, pour liquid into some cups?"
631,3,"How many times in total did the hamster stand on its hind legs in the video? (Camera cuts are counted, but jumps are not.)"
650,3,How many times is the iron used in the video during the hat-making process? (Each time the iron touches and is lifted from the fabric counts as one use.)
660,3,How many scenes in this video use knives? (A shot change counts as one scene.)
673,3,What is the difference between the number of types of non-liquid ingredients placed in the silver basin and the number of types placed in the black pot?
684,3,How many kinds of items did the woman in the striped clothes take with her right hand?
685,3,"In the video, how many times in total did the pika carry food? (Count repeated instances.)"
705,3,How many times did the red water ladle appear during the food preparation?
710,3,"Watch the video. In total, how many times do the two birds tuck their beaks into their wing feathers?"
750,3,"Among the groups of penguins gathered on the snow, how many times did the number of penguins reach or exceed 15?"
757,3,"In the video, what is the difference between the number of times the man in the black jacket appears alone and the number of times he appears together with the woman in the black top?"
773,3,How many times in total did the person in front of the goal practice making saves?
823,3,In how many different locations did the little grey cat appear in total?
825,3,How many times in total did the lady pour the crushed chili into the silver bowl?
838,3,How many total digging motions did the person holding the shovel perform in the video?
850,3,"In the video, how many different types of items is the woman performing on the unicycle balancing on her head?"
852,3,How many times as often was the red silk ribbon grabbed by the male performers as by the female performers?
859,3,"In total, how many different locations does the lady who appears at the beginning of the video appear in?"
875,3,How many goals in total did the team in white jerseys score during the entire soccer match?
897,3,What is the total number of times the person in the blue top chops and cuts the mutton in the video?
907,3,How many times does a serving motion appear in the video?
910,3,How many times in total did the male player in the yellow shirt hit the ball?
912,3,How many red side heroes in total did the hero using dual pistols kill in the video?
934,3,"In the video, how many times is the transparent container with yellow liquid picked up?"
954,3,How many police officers with epaulettes can be seen in the video?
962,3,"In the video, a woman wearing a qipao appears in indoor, snowy, and courtyard exterior wall scenes. If you count the number of other women present in each scene alongside her, which of the following options matches the statistical results?"
965,3,"How many different outfits in total did the woman with short, curly hair wear in the video?"
971,3,How many of the necklaces worn by the ladies in the video are yellow?
972,3,How many times in total did the woman in the wedding dress wear earrings in the video?
