ID,num_models,question
977,3,"In the video, between the male character pinning on his badge and the two of them appearing in the office, how many split screens contrasting the new and old appear in total?"
979,3,How many times in the video is there a shot of a runner falling and getting back up?
980,3,How many times in total was the car interior shown in the video?
983,3,How many times in total did the courtyard appear in the video?
984,3,How many veterans in the video explicitly stated in their interviews that they are unwilling to recall the past?
987,3,"In the video, multiple vintage players are playing footage of singers performing. How many singers in total appear on the players?"
989,3,"Based on the youth representatives and their work settings shown in the video, which scene features them the most times?"
993,3,"In the video, from when the character starts fanning themselves in the courtyard to the final overhead shot of the building, how many times are eaves or roofs shown?"
1008,3,"In the video, from the first time the worker appears in the underpass to their final appearance on top of the building, how many times is the worker seen wearing a safety helmet?"
1014,3,"According to the video, how many real-world work scenarios are shown after putting on the VR headset?"
1020,3,"According to the video, how many times does the character hold a red flower in the segments that take place in the garden?"
1031,3,"In the video, how many times does a shot appear where a person and a white horse are together, and the person is in at least partial physical contact with the horse (such as stroking, leading, etc.)?"
1035,3,"Based on the sports and scenes presented in the video, from a first-person perspective, how many times did an activity involving contact with water occur?"
1045,3,How many outfits did the male and female leads change into in the video?
1047,3,"Disregarding repeated appearances, how many children are in the video?"
1052,3,How many luggage racks in total did the first person to appear in the video open?
1055,3,"How many large, closed sun umbrellas are in the video?"
1061,3,"Of the two types of planets introduced in the video, which are the largest planets by volume in each category, respectively? By what factor do their volumes differ?"
1075,3,How many photos are shown in the video?
1087,3,The video shows that the land area of Zhejiang Province accounts for approximately what percentage of China's total land area?
1095,3,How many countries and regions are mentioned in the video?
1109,3,How many bands or groups are mentioned in the video?
1113,3,How many smart devices appear in the video clip?
1122,3,How many behavioral meanings does the video explain?
1127,3,How many types of animals (broad categories) appeared in the video in total?
1131,3,How many women in white wedding dresses are in the video?
1138,3,How many lion dancers appear in total in the video clip?
1144,3,How many shots of wailing or crying are there in total in the video?
1149,3,How old is the woman in the video?
1150,3,How much did the food in this video clip cost in total?
1164,3,How many women appear in the background image of the video?
1166,3,How many types of human organ transplants appeared in the video?
1174,3,How many obtuse triangles does the finished product made in the video contain in total?
1175,3,How many banners are hanging from the ceiling in total?
1189,3,How many types of intangible cultural heritage are shown in the video?
1191,3,How many small flower buns are there in total on the outermost ring of the decorative steamed bun being made in the video?
1196,3,"If you bought this piece of menswear from the video and recommended it to your bestie, how would you answer if she asked what the discount was compared to the retail store price?"
1204,3,How many steps are there in the method demonstrated by the person in the video? (Count opening and removing as one step.)
1208,3,How many training poses did the man in the video recommend in total?
1229,3,How many times do the pyramids appear in the video?
1235,3,"How many books with the words ""illustrated catalog"" on them did the person in the video take out in total?"
1243,3,How many types of laparoscopic surgery are mentioned in the video?
1251,3,How many circles are there next to the pink flower in the video?
1259,3,How many shots were fired in total during the three-person standoff in the video?
1276,3,How many bottle caps were stuck on the disc in the video?
1280,3,Is the airport construction tax in Ireland shown in the video higher or lower than the 50 yuan for domestic flights?
1289,3,How old was Jiang Xiaoqing in the video when he went to study at the Chuanshan Academy in Hengyang? How many years was the gap between then and when he became a xiucai?
1299,3,Approximately how much would it cost in RMB to purchase the headphones in the video? (Exchange rate: 1 USD ≈ 7.1859 RMB)
1301,3,How many successful shots are shown in the video footage?
1329,3,How many different folk cultures from different places appeared in the video?
1332,3,How many steps does the person in the video perform on the shoes?
1337,3,How many types of food are shown in the video?
1342,3,What was the province's share of the projects built with Soviet aid?
1357,3,How many times in total did all the people in the video stand up?
1359,3,How many times is the first set of movements in the video supposed to be done?
1365,3,How many more people were there at the end of the video than at the beginning?
1382,3,How many must-visit attractions are there in the video?
1383,3,How many things are there in total on the dining table in the video?
1401,3,"After the historical turning point mentioned in the video, how was the average land area required for each person's life improved?"
1404,3,How many people are in the video?
1414,3,How many apps in total are on the phone introduced in the video?
1420,3,How many suggestions did the woman in the video make in total?
1421,3,Did the video show the prices of multiple hotels? How many are less than 100?
1428,3,How many manual operations occurred in the video?
1429,3,"Based on the content of the video, in what year did the war end?"
1449,3,How many kinds of agricultural products from Jianli are introduced in the video?
1452,3,How many gift boxes and shipping boxes were unboxed in total in the video?
1454,3,How far can the hoverbike featured in the video fly on a single charge?
1458,3,How many people are holding umbrellas in the video?
1466,3,How many international air routes are mentioned in the video?
1468,3,"In the video, there are small house models of various colors on the table. What is the probability of randomly picking a blue house model?"
1471,3,How many billiard balls were pocketed in the video?
1473,3,How many book titles did the author introduce in the video?
1493,3,How many outfits are shown in the video?
1498,3,"How many times did the hands perform the ""unscrewing"" action in the video?"
1521,3,"The number of times the woman wearing a wedding dress at the beginning of the video wears a wedding veil throughout the entire video, divided by the number of men wearing suits, is closest to which of the following values?"
3,2,"How many film and TV adaptations of Journey to the West are introduced in the video in total, and which of them is a co-production between two countries?"
13,2,How many pieces of clothing did the lady in the video touch in total?
19,2,How many years are there between the first and last events in the video?
34,2,How many empty bottles were shown in the video in total?
35,2,How many vassal kings were enfeoffed in total in the video?
38,2,How many mythical creatures from the *Classic of Mountains and Seas* were introduced in the video?
40,2,How many life hacks are recommended in this video clip?
46,2,How many more girls than boys are playing the guitar in the video?
48,2,How many times did the person in the video throw away the trash?
49,2,What is the difference between the number of adults and children in this video clip?
51,2,How many pest control methods are introduced in the video?
68,2,How many character posters appear in the video?
71,2,How many round windows can be seen in the video? (Excluding duplicates)
74,2,How many years apart were the two hard drives mentioned in this video clip invented?
77,2,How many Hellobikes appear in the video?
79,2,How many types of Chinese terrain are introduced in this video clip?
81,2,How many lion heads passed by in the video?
87,2,How many years passed between the discovery of the archaeological site mentioned in the video clip and its formal excavation?
89,2,What is the difference in days between the first and third of the three calendars presented in the video text?
95,2,"In the video, how many more earthquakes did the dynasty with the most earthquakes have than the dynasty with the second most?"
98,2,How many real historical figures who passed the imperial examination are mentioned in the video?
99,2,How many people in the video are wearing masks?
102,2,How many production steps does the intangible cultural heritage in the video have?
107,2,Approximately how many black and white movies did the author count in the video?
111,2,The building in the video has two different types of rooms. What is the difference in the number of these two types of rooms?
112,2,How many books are shown in the video clip?
116,2,What was the difference in age at death between the emperor mentioned in the video and his own mother?
117,2,How many vehicles in total passed by in the motor vehicle lane to the left of the person filming in the video?
127,2,How many backflips did the man in the video do?
131,2,How many cows are in the video?
139,2,How many different instruments did the performers in this video play in total?
144,2,How many characters were copied in the video?
146,2,How many times did the woman stir in the specified video clip?
154,2,What is the approximate area in square centimeters of the cabinet the blogger made in the video?
158,2,How many exercises did the blogger recommend in the video?
162,2,What is the difference in sun cost between the most expensive and least expensive plants selected in the video segment?
167,2,How many shot transitions are there in the video?
169,2,How many times in total did the woman in the video lift the dumbbell with one hand?
178,2,How many cats appeared in the video clip?
181,2,What is the difference in meters between the fan diameters of the two airplanes in this video clip?
184,2,How many devices did the man in the video introduce?
186,2,How many paintings were shown in close-up in the video clip?
194,2,"What rank is Taiwan, China, in the video?"
196,2,How many animals appeared in the handmade craft in the video?
200,2,How many road signs appeared in the video?
202,2,What was the appearance order of the man with tattoos in the specified video?
203,2,How many necklaces were introduced in the video?
208,2,How many dishes appeared in the video in total?
216,2,How many times did the woman in the video perform the action?
218,2,How many shots appeared in the video clip?
220,2,How many girls appeared in the shot (not counting repeat appearances)?
221,2,How many items is the man showing in his hands in the video?
226,2,How many colorways of this shoe are shown in the video?
229,2,How many seconds in total does it take to complete the five sets of steps five and six of adult first aid in the video?
235,2,How many dishes on the menu in the video are marked with a crown symbol?
236,2,How many hours are there between the departure time and the time of the last event on the itinerary shown in this video clip?
238,2,How much did the woman in the video spend on food in total?
242,2,How many Samoyeds are in the video?
247,2,How many times in total were the drawers pulled to show the tableware in the video?
248,2,How many arms does the sixth starfish in the video have?
251,2,How many times did the cat's tail twitch in the video?
256,2,What is the probability of randomly getting the Dragon zodiac cup in the video?
262,2,How many poses did the woman in the video change into?
266,2,How many male attendants are in the video?
268,2,How many kinds of animals appeared in the video?
271,2,How many yellow chairs are in the video?
277,2,What is the total percentage of people who are mentally sub-healthy and completely mentally healthy in this video clip?
278,2,What is the total number of people appearing in the three scenes of the video clip?
280,2,What is the date of birth on the old lady's ID card in the video?
297,2,How many children learning acrobatics are mainly featured in the video? How many of them are girls?
298,2,How many more shots with a white background are there than shots with a black background in the video clip?
305,2,"In the video, how many times in total did the man in black and the man in grey exchange the playing cards?"
313,2,"How many times does the word ""Persistence"" on the wall appear in the video? What actions does the man in the video perform each time it appears?"
314,2,How many goals in total did the team in red jerseys score in the video?
317,2,How many more goals did the team in red score than the team in white?
318,2,"In the video, how many players in white jerseys did the man in the black short-sleeved shirt interfere with during their practice?"
320,2,What is the man's shooting percentage in the video?
329,2,"On the basketball court, who made more baskets: the man wearing the number 9 jersey or the man wearing the black hoodie?"
330,2,"In the video, how many times does the man move forward while bouncing the ball with both hands?"
338,2,How many steps are involved in the man in the black shirt's preparation of the pork liver?
339,2,"In the video, at which step is the chili oil poured?"
343,2,How many times in total were seasonings added throughout the cooking process?
348,2,A man in an apron took a fish from a basin and prepared it. How many steps did this process involve?
361,2,How many different locations did the man in the blue jacket pass through in total?
369,2,How many times did the man in the black jacket appear in the video?
375,2,"In the process of cooking duck, out of these ten seasonings—ginger, cooking wine, Sichuan peppercorns, dried chilies, rock sugar, light soy sauce, salt, dark soy sauce, beer, and water—how many are used twice?"
381,2,"During the cooking process, excluding water, how many ingredients and seasonings in total were added to the pot?"
382,2,"During the making of Tibetan incense, what is the square of the number of times that the action of a stone pestle grinding medicinal herbs and a shot of the herbs are seen simultaneously?"
383,2,How many non-meat ingredients and seasonings did the man in grey clothes add to the black iron pot?
388,2,How many different seasonings did the man use in total to marinate the meat slices? (Anything added after the meat slices is also considered a seasoning.)
389,2,"During the process of making the seasoning, how many types of seasonings in total were ground in the stone mortar?"
390,2,How many ingredients were used in total to marinate the chicken?
394,2,What is the sum of the number of times the old man in red scooped soil out of the box and the number of times he scooped soil out of the bucket?
406,2,"In the video, of the two people eating chicken feet, how many times did the man bite the chicken feet?"
409,2,"In the video, how many times in total did the woman in the white top put green plants into the red basket?"
410,2,"How many times did the woman in the black jacket and the woman in the white jacket appear in the video, respectively?"
412,2,How many things in total did the man in the light yellow jacket add to the pot during the cooking process?
417,2,How many different football matches are shown in this video?
422,2,"In the video, how many different types of fruit did the woman in the white top pick?"
429,2,How many times in total were ingredients and seasonings added to the pot during the cooking process?
433,2,How many times does a clearly visible utility pole with red and white stripes appear in the video? (Do not count blurry ones in the background.)
435,2,What percentage of the total shots were taken by the player in the blue #11 jersey? (Including replays)
436,2,"In the video, how many times does the woman in the pink top scoop food out of the black pot with a silver slotted spoon?"
439,2,How many times in total did the man in the red jacket jog in the video?
443,2,How many times in total is a kitchen knife used to chop downwards in the video?
452,2,How many times did the scene of the woman in a white top riding a white motorcycle appear?
454,2,How many circles did the woman in the purple hoodie stir in the vat with a dark brown stick?
456,2,"In total, in how many different outdoor locations does a car with a yellow body appear? (Each camera shot change counts as one appearance)."
463,2,"In the video, how many times does the man in the white top and black backpack look back?"
464,2,How many times were powdered and liquid seasonings used in the video during the cooking process?
471,2,How many times in total did the chicken feet appear in the white transparent liquid in the video? (Count reappearances after scene changes.)
473,2,How many types of ingredients did the woman in the light blue top and dark blue vest touch in the video? (Count duplicates as one).
478,2,"In the video, how many times does the man point forward with his left hand and his right hand, respectively?"
479,2,How many hunting attempts did the shoebill stork make in the video?
482,2,"How many times in total did the person in green run in the video? (If the camera angle changes during a run, it is counted as one time.)"
487,2,"How many different types of kitchen utensils did the woman use in total while cooking the crayfish and noodles? (All tools used in this process are considered kitchen utensils, excluding the water tap.)"
496,2,What percentage of the total number of pigs in the video were put into woven sacks?
502,2,"After the baking is complete, how many times does the woman in the purple top strike the clay casing with a tool?"
520,2,"What is the number of times the character uses scissors to handle the shrimp, multiplied by the number of times the shrimp is wiped with a paper towel? (Repeated occurrences also count.)"
523,2,"How many times did an elderly lady in a cyan, floral-patterned top cut with a cleaver? (Count only complete cutting motions.)"
532,2,"According to the video, how many more scenes are there of a monkey striking a stone with a shell than of a monkey striking a shell with a stone? (Shot changes do not count.)"
537,2,How many different types of mushrooms were there?
542,2,How many times did it cut to the scene of seals resting on the ice?
552,2,How many times did the silver spatula appear while the meat patties were being pan-fried? Repeated appearances should be counted.
568,2,"Throughout the video, how many black sea urchins did the larger, all-orange fish clear? (Repeated footage is counted)."
570,2,Did the woman in a light purple long-sleeved top and a dark plaid suspender skirt pick up several different items from the ground? (appears once)
574,2,How many times in total did the man in the black short-sleeved shirt eat the food in his hand?
577,2,"In the video, in how many different places in total did the middle-aged woman with her hair in a bun and wearing dark clothes search?"
579,2,"In the video, how many times in total did those spiky aquatic plants attempt to push their tips above the water's surface?"
581,2,"During the cooking process, at which step are powdered seasonings added?"
585,2,"In the video, how many times in total were dishes brought to the table?"
592,2,"In the video, how many different styles of clothing did the woman show in total?"
597,2,"What is the total number of times the praying mantis in the video raises both of its raptorial legs? (If the action reoccurs after a shot change, each instance should be counted.)"
599,2,"Of all the people in the video, how many are wearing clothes with the primary colors of art?"
615,2,How many times does the red national flag appear? (Repeated appearances are counted)
616,2,How many times did the foldable picnic chair appear in total?
622,2,How many scenes feature cows? Shot changes are counted.
626,2,How many dishes were cooked in the black pot in the video?
636,2,How many people in total did the winding work in the video? (The same person appearing multiple times still counts as one person.)
637,2,How many baby crocodiles are poking their heads out of the sand in the video?
639,2,How many times does the frog bite off the snail's antennae in the video?
642,2,"In the video, how many times did the rusty-spotted cat's paws appear on the ground and in the trees, respectively?"
661,2,"In the video, how many times does the elderly woman in the red top scoop up white liquid with a silver container and pour it into a filter cloth?"
665,2,What is the total number of times white food was put into the black pot?
667,2,"What is the least common multiple of the number of tools the man in the black hat uses to process the black strips, and the number of tools used to process the ox horn?"
675,2,"In the video, how many different vegetables in total appeared in the hands of the woman wearing the pink floral top?"
677,2,"How many people are there in total in the picture? If you remove the people wearing glasses, how many are left?"
688,2,"A winged insect is gnawing on an egg mass containing white larvae, during which several larvae break free and eventually fall into the water?"
692,2,Multiple people in the video are participating in the activity of peeling vegetable leaves. How many leaves did the elderly person in the red top peel off in total? (Only a successfully peeled leaf counts as one.)
695,2,"Throughout the entire process of making the wooden utensil, how many different tools did the man use in total?"
698,2,How many different animals appear in this video?
703,2,"In the video, how many times in total does the woman knead the food?"
704,2,What ingredients did the lady in the purple ethnic costume add to the golden bowl while making food?
707,2,How many times do the brush and the oysters appear together in the video?
714,2,"In the video, how many times does the elderly person in wine-red clothes cut the large, white solid object with a knife?"
717,2,"Throughout the entire video, how many times did the woman in the yellow safety helmet press her hands together in front of her chest? (It only counts as one time if her hands are completely touching.)"
720,2,"In the video, how many different types of processing does the man in camouflage and a hat perform on the bamboo with a knife?"
735,2,How many minor children in the video received red cylindrical objects after hitting the badminton shuttlecock?
738,2,The players in which color jersey successfully blocked the ball from entering the goal more times?
752,2,"In the video, what is the percentage of successful golf shots by the woman in black out of her total number of attempts?"
756,2,"In the video, the woman in the pink top adds ingredients to a large black pot. Which ingredient is added the most times?"
761,2,"In the badminton court, how many forehand strokes did the man in the light blue shirt complete in total while standing?"
769,2,"In the video, how many times were ingredients added to the stone pot during the cooking process?"
770,2,How many times in total did the action of cutting ingredients with a knife occur?
775,2,"In the outdoor scenes, how many times in total does the woman wearing purplish-red Tibetan attire appear using scissors to cut animal fur? (Count each camera cut as one instance.)"
777,2,What is the ratio of the number of times the elderly lady in a red top is holding a red envelope to her total number of appearances?
788,2,"Of all the kitchenware shown in the video, which of the following items has the most styles?"
794,2,How many types of ingredients are picked up with chopsticks in the video?
797,2,How many women in white jerseys appeared in the short film in total?
798,2,"There are multiple scenes of applause in the short film. Of the following options, which man clapped the most times?"
815,2,How many times in total did the blonde girl appear with long hair flowing over her shoulders and hair accessories on top of her head?
820,2,How many times did players wearing dark jerseys jump and bump into each other in pairs?
832,2,What is the shooting percentage of the man in the grey top on the basketball court?
837,2,"How many times in total did the woman, wearing a traditional costume and a headband strung with red and blue gems, lift her right leg while jumping on the bamboo pole?"
840,2,Which appears more in the video: the black and white soccer ball or the red and white rugby ball? And by how many times?
846,2,"On the badminton court, which type of shot does the lady in the white top use most often?"
857,2,"In the video, how many times does the taller man in camouflage lift up the child, who is also in camouflage, with both hands? (Lifting the child up and then placing them back on the ground counts as one complete time.)"
861,2,How many times does the woman in blue and white clothing hang upside down from the purple hoop with her legs together?
863,2,How many times did the man in camouflage-patterned clothes do a handstand on the white rack?
876,2,How many times did the boy in the blue jersey attempt to block the goal? What is the percentage of successful blocks out of the total attempts?
878,2,What is the sum of the jersey numbers of the two little boys who scored the goal?
881,2,How many types of seasonings did the woman in the video add to the large black pot in total?
886,2,How many stairs did the boy in red climb in a one-handed handstand?
